{
  "format": "hyper-control-mappings",
  "format_version": 1,
  "id": "018f47a2-6b2d-7c11-8a44-001122334474",
  "project_id": "018f47a2-6b2d-7c11-8a44-001122334455",
  "bindings": [
    {
      "id": "018f47a2-6b2d-7c11-8a44-001122334475",
      "enabled": true,
      "source": { "kind": "cv-input", "input_index": 0 },
      "scope": { "kind": "global" },
      "transform": {
        "kind": "linear",
        "input_min": -1000000,
        "input_max": 1000000,
        "output_min": 0,
        "output_max": 1000000
      },
      "target": {
        "kind": "mixer-channel",
        "track_id": "018f47a2-6b2d-7c11-8a44-001122334456",
        "parameter": "gain"
      }
    }
  ],
  "extensions": {}
}
